{
  "rubricVersion": "ARS v0.2",
  "toolVersion": "0.0.0",
  "scoredCheckCount": 22,
  "registryFingerprint": "176a3461",
  "target": {
    "name": "@shopify/polaris",
    "path": "polaris/polaris-react",
    "detectedCarriers": [
      "CSS files",
      "Storybook stories/MDX",
      "TypeScript exports",
      "package.json exports/types",
      "token files/CSS custom properties"
    ]
  },
  "weights": {
    "source": "default",
    "values": {
      "docs": 25,
      "api": 20,
      "guidance": 15,
      "tokens": 15,
      "deprecation": 15,
      "agent": 10
    }
  },
  "composite": 68.7,
  "applicability": {
    "applicable": 18,
    "total": 22,
    "confidence": "medium"
  },
  "categories": [
    {
      "id": "docs",
      "score": 78.6,
      "applicable": 4,
      "total": 4,
      "weightRedistributed": false
    },
    {
      "id": "api",
      "score": 88,
      "applicable": 3,
      "total": 4,
      "weightRedistributed": false
    },
    {
      "id": "guidance",
      "score": 47.9,
      "applicable": 2,
      "total": 3,
      "weightRedistributed": false
    },
    {
      "id": "tokens",
      "score": 94.9,
      "applicable": 3,
      "total": 3,
      "weightRedistributed": false
    },
    {
      "id": "deprecation",
      "score": 67.1,
      "applicable": 2,
      "total": 3,
      "weightRedistributed": false
    },
    {
      "id": "agent",
      "score": 0,
      "applicable": 4,
      "total": 5,
      "weightRedistributed": false
    }
  ],
  "findings": [
    {
      "checkId": "docs.usage-examples",
      "category": "docs",
      "severity": "critical",
      "outcome": "fail",
      "measure": {
        "kind": "ratio",
        "value": 0.754,
        "detail": "89/118 exported components have importable usage examples; missing: ActionMenu, AlphaPicker, AutoSelection, Backdrop, BadgeProgressValue, BadgeStatusValue, Breadcrumbs, Connected, EventListener, Focus, IndexFiltersMode, IndexTableSelectionType, Indicator, Key, KeypressListener, Label, Labelled, PolarisTestProvider, PopoverCloseSource, Portal, PortalsManager, PositionedOverlay, ScrollLock, Sticky, TrapFocus, Truncate, UnstableBulkActions, UnstyledButton, UnstyledLink"
      },
      "evidence": [
        "ActionMenu",
        "AlphaPicker",
        "AutoSelection",
        "Backdrop",
        "BadgeProgressValue",
        "BadgeStatusValue",
        "Breadcrumbs",
        "Connected",
        "EventListener",
        "Focus",
        "IndexFiltersMode",
        "IndexTableSelectionType",
        "Indicator",
        "Key",
        "KeypressListener",
        "Label",
        "Labelled",
        "PolarisTestProvider",
        "PopoverCloseSource",
        "Portal"
      ],
      "fix": "Add one canonical story/example per component.",
      "receipt": "Agents recreate components they can't see used (Atlassian DESIGN.md experiment)."
    },
    {
      "checkId": "docs.example-imports-real",
      "category": "docs",
      "severity": "critical",
      "outcome": "fail",
      "measure": {
        "kind": "ratio",
        "value": 0.991,
        "detail": "526/531 example component imports resolve against exported components; unresolved: BulkActions, IndexFiltersProps, Fragment, ScrollableRef, ShadowBevel"
      },
      "evidence": [
        "BulkActions",
        "IndexFiltersProps",
        "Fragment",
        "ScrollableRef",
        "ShadowBevel"
      ],
      "fix": "Correct or delete examples with dead imports.",
      "receipt": "Wrong import paths are a documented agent failure mode (Astryx self-checks)."
    },
    {
      "checkId": "api.types-resolve",
      "category": "api",
      "severity": "critical",
      "outcome": "na",
      "measure": {
        "kind": "ratio",
        "value": 0,
        "detail": "entrypoints point at build output absent from this checkout (unbuilt source clone); types resolution not assessed: build/cjs/index.js, build/esm/index.js, build/ts/src/index.d.ts"
      },
      "evidence": [],
      "fix": "Repair the package types/exports mapping so every public export is importable.",
      "receipt": "Wrong import paths are a documented agent failure mode."
    },
    {
      "checkId": "deprecation.marked",
      "category": "deprecation",
      "severity": "critical",
      "outcome": "fail",
      "measure": {
        "kind": "ratio",
        "value": 0.563,
        "detail": "9/16 known-deprecated exports carry @deprecated; missing: LegacyCardHeaderProps, LegacyCardProps, LegacyCardSectionProps, LegacyCardSubsectionProps, LegacyFiltersProps, LegacyStackProps, LegacyTabsProps"
      },
      "evidence": [
        "LegacyCardHeaderProps",
        "LegacyCardProps",
        "LegacyCardSectionProps",
        "LegacyCardSubsectionProps",
        "LegacyFiltersProps",
        "LegacyStackProps",
        "LegacyTabsProps"
      ],
      "fix": "Add @deprecated to legacy exports.",
      "receipt": "Deprecated patterns dominate training data unless current source clearly marks them as deprecated."
    },
    {
      "checkId": "agent.instruction-manual",
      "category": "agent",
      "severity": "critical",
      "outcome": "na",
      "measure": {
        "kind": "ratio",
        "value": 0,
        "detail": "0 agent metadata files found; instruction-manual orientation is not applicable."
      },
      "evidence": [],
      "fix": "Rewrite metadata examples to import the design-system components instead of re-implementing them.",
      "receipt": "Re-implementation specs cause agents to recreate components instead of using the system."
    },
    {
      "checkId": "docs.prop-descriptions",
      "category": "docs",
      "severity": "warning",
      "outcome": "fail",
      "measure": {
        "kind": "ratio",
        "value": 0.703,
        "detail": "83/118 exported components have documented public props; missing: ActionMenu, AppProvider, Autocomplete, Backdrop, Bleed, BlockStack, Box, Card, ColorPicker, DataTable, DatePicker, EmptySearchResult, EventListener, Filters, Focus, Form, Grid, Image, Indicator, InlineGrid, KeyboardKey, LegacyTabs, Listbox, Navigation, Portal, PortalsManager, PositionedOverlay, SelectAllActions, SkeletonTabs, Sticky, Tabs, ThemeProvider, TrapFocus, Truncate, UnstyledButton"
      },
      "evidence": [
        "ActionMenu: hasRolledUp",
        "AppProvider: theme",
        "Autocomplete: selected",
        "Backdrop: belowNavigation, transparent, setClosing",
        "Bleed: children",
        "BlockStack: children",
        "Box: children",
        "Card: children",
        "ColorPicker: color",
        "DataTable: hasFixedFirstColumn",
        "DatePicker: date, month, year",
        "EmptySearchResult: title, description, withIllustration",
        "EventListener: passive",
        "Filters: queryValue, mountedState, selectedViewName",
        "Focus: children, disabled, root",
        "Form: event",
        "Grid: columns, gap, children",
        "Image: alt, source, crossOrigin, sourceSet, ref",
        "Indicator: pulse",
        "InlineGrid: children"
      ],
      "fix": "Add TSDoc descriptions to public props, starting with the most-used components.",
      "receipt": "Agents invent props when public prop contracts lack descriptions."
    },
    {
      "checkId": "docs.undocumented-exports",
      "category": "docs",
      "severity": "warning",
      "outcome": "fail",
      "measure": {
        "kind": "count",
        "value": 149,